{
  "artifact_type": "run_manifest",
  "schema_version": "1.0.0",
  "run_id": "contract-replay-001",
  "created_at": "2026-09-23T09:00:00Z",
  "protocol_version": "draft-0.2",
  "dataset_version": "development-0.1.0",
  "code_revision": "working-tree",
  "condition_manifest_id": "default-conditions-v1",
  "scenario_ids": ["scope-deletion-001"],
  "provider": "none",
  "model": "no-model-contract-replay",
  "prompt_hashes": {
    "system": "0000000000000000000000000000000000000000000000000000000000000000",
    "task": "1111111111111111111111111111111111111111111111111111111111111111"
  },
  "seed": 0,
  "repeats": 1,
  "analysis": {
    "repeat_aggregation": "mean-within-condition-query",
    "scenario_weighting": "equal",
    "independent_unit": "template_family",
    "interval_method": "paired-cluster-bootstrap",
    "multiplicity_method": "simultaneous-bootstrap-intervals",
    "h1_decision_rule": "improvement-required-against-all-baselines"
  },
  "status": "prepared"
}
